{"auditSha256":"648176dc9f3fdd349c180a714a286abd993e0d4f5bd8c81f5b5dfd16aefaffa1","axiomDependentDeclarationCount":5,"axiomFreeDeclarationCount":19,"axiomInventory":["propext"],"declarationCount":24,"rfcClauseIds":["ASP-RFC-10.05-EVFC-CANONICAL-SERIALIZATION","ASP-RFC-10.05-EVFC-CHAIN-PROJECTION","ASP-RFC-10.05-EVFC-DECODE","ASP-RFC-10.05-EVFC-GLOBAL-LIFT","ASP-RFC-10.05-EVFC-INDEPENDENT-REPLAY","ASP-RFC-10.05-EVFC-INVOCATION","ASP-RFC-10.05-EVFC-KEY-REGISTRY","ASP-RFC-10.05-EVFC-PREFIX-INSUFFICIENT","ASP-RFC-10.05-EVFC-STAGE-CLOSURE","ASP-RFC-10.05-EVFC-VERIFIER-RESOLUTION"],"schemaId":"asp.axle-lean-audit-receipt.v1","schemaVersion":"1","theoremFamilies":["admitted-global-lift","canonical-serialization","chain-projection","cryptographic-edge-projection","decode-conformance","invocation-conformance","key-registry-resolution","prefix-insufficiency","replay-independence","stage-closure","successor-continuity","verifier-resolution"]}
