{"auditSha256":"71925c6b3b86dd6aea5b80d0188189b3b66714f976479001634c7c3d33707292","axiomDependentDeclarationCount":11,"axiomFreeDeclarationCount":2,"axiomInventory":["Quot.sound","propext"],"declarationCount":13,"rfcClauseIds":["ASP-RFC-10.05-BAIC-BATCH","ASP-RFC-10.05-BAIC-BOUND","ASP-RFC-10.05-BAIC-PARTITION","ASP-RFC-10.05-BAIC-PROGRESS","ASP-RFC-10.05-BAIC-READY","ASP-RFC-10.05-BAIC-ROUND","ASP-RFC-10.05-BAIC-ROUTER","ASP-RFC-10.05-BAIC-STATE","ASP-RFC-10.05-BAIC-STEP","ASP-RFC-10.05-BAIC-TOKEN"],"schemaId":"asp.axle-lean-audit-receipt.v1","schemaVersion":"1","theoremFamilies":["batch-potential-reduction","complete-partition-exact-disclosure","exact-llm-round-accounting","inspect-step-request-identity","no-op-inspect-rejection","readiness-exact-disclosure","readiness-requires-chain-proof","run-partition-preservation","run-round-upper-bound","run-token-potential-conservation","step-partition-preservation","step-token-potential-conservation","strict-missing-potential-decrease"]}
