{"auditSha256":"ec4ca6041c5846c9cf87b0ef0224bcd04bb0357593d041bfb2382a7ce13645e0","axiomDependentDeclarationCount":4,"axiomFreeDeclarationCount":17,"axiomInventory":["propext"],"declarationCount":21,"rfcClauseIds":["ASP-RFC-10.05-CTRB-ALGORITHM","ASP-RFC-10.05-CTRB-CANONICAL-PAYLOAD","ASP-RFC-10.05-CTRB-CHAIN-PROJECTION","ASP-RFC-10.05-CTRB-DIGEST-BOUNDARY","ASP-RFC-10.05-CTRB-DUAL-SIGNATURE-CONTEXT","ASP-RFC-10.05-CTRB-GLOBAL-LIFT","ASP-RFC-10.05-CTRB-KEY-EPOCH","ASP-RFC-10.05-CTRB-REPLAY-DOMAIN","ASP-RFC-10.05-CTRB-TEMPORAL-SCOPE"],"schemaId":"asp.axle-lean-audit-receipt.v1","schemaVersion":"1","theoremFamilies":["admitted-global-lift","algorithm-binding","cryptographic-edge-admission","digest-collision-gap","digest-uniqueness","key-epoch-binding","key-revocation","payload-binding","registry-chain-bridge","replay-domain-binding","successor-continuity","temporal-scope","weak-verification-gap"]}
