{"auditSha256":"ec4388623b24f31b542395476eb2cdc2a5595d268f2312383056f506e55107e3","axiomDependentDeclarationCount":3,"axiomFreeDeclarationCount":4,"axiomInventory":["Quot.sound","propext"],"declarationCount":7,"rfcClauseIds":["ASP-RFC-10.05-PFVC-FRONTIER-LOCAL","ASP-RFC-10.05-PFVC-GLOBAL-COUNTERMODEL","ASP-RFC-10.05-PFVC-GLOBAL-LIFT","ASP-RFC-10.05-PFVC-HOP-COUNTERMODEL","ASP-RFC-10.05-PFVC-STRICT-COMPOSE","ASP-RFC-10.05-PFVC-VECTOR-IMPLIES-HOP"],"schemaId":"asp.axle-lean-audit-receipt.v1","schemaVersion":"1","theoremFamilies":["coverage-strength","dominance-composition","frontier-local-minimality","global-dominator-countermodel","global-pareto-lift","hop-only-countermodel"]}
