{"auditSha256":"51a73d6b9f34b2983d02a3a46a4b51a6a8515e8d0fcdbd133c49e4cc599443bb","axiomDependentDeclarationCount":4,"axiomFreeDeclarationCount":7,"axiomInventory":["propext"],"declarationCount":11,"rfcClauseIds":["ASP-RFC-10.05-BCC-BATCH-DECREASE","ASP-RFC-10.05-BCC-FOUR","ASP-RFC-10.05-BCC-NONEMPTY","ASP-RFC-10.05-BCC-ROUND-BOUND","ASP-RFC-10.05-BCC-ROUND-NOT-WORK","ASP-RFC-10.05-BCC-STRICT","ASP-RFC-10.05-BCC-TOKENS","ASP-RFC-10.05-BCC-TOOLS","ASP-RFC-10.05-BCC-UNDERREPORT","ASP-RFC-10.05-BCC-VALID","ASP-RFC-10.05-BCC-ZERO-ROUND"],"schemaId":"asp.axle-lean-audit-receipt.v1","schemaVersion":"1","theoremFamilies":["batch-measure-credit","batch-round-bound","four-route-batch-witness","nonempty-round-consumption","parallel-accounting-witness","round-only-underreport","round-work-separation","strict-batch-decrease","token-work-conservation","tool-work-conservation","zero-round-rejection"]}
