{"auditSha256":"a91880481b2399935e018d3a9410fd8ddcad3b8ee6c3c4d568c938a33055cc01","axiomDependentDeclarationCount":4,"axiomFreeDeclarationCount":13,"axiomInventory":["Quot.sound","propext"],"declarationCount":17,"rfcClauseIds":["ASP-RFC-10.05-FPBS-AUTHORIZATION","ASP-RFC-10.05-FPBS-DOMINANCE","ASP-RFC-10.05-FPBS-ESTIMATE","ASP-RFC-10.05-FPBS-FEASIBLE","ASP-RFC-10.05-FPBS-FORECAST","ASP-RFC-10.05-FPBS-IDENTITY","ASP-RFC-10.05-FPBS-PARETO","ASP-RFC-10.05-FPBS-REALIZATION","ASP-RFC-10.05-FPBS-ROUTER","ASP-RFC-10.05-FPBS-TRADEOFF"],"schemaId":"asp.axle-lean-audit-receipt.v1","schemaVersion":"1","theoremFamilies":["batch-authorization-chain-proof","batch-authorization-disclosure-proof","batch-authorization-feasibility","dominated-plan-rejection","feasible-batch-nonempty","feasible-batch-ordered-sublist","feasible-batch-strict-progress","forecast-digest-only-counterexample","forecast-mismatch-dominance-rejection","forecast-probability-bounds","forecast-realization-nondeterminism","lane-scoped-work-estimation","pareto-dominance-irreflexivity","pareto-frontier-safety","realization-forecast-binding","token-only-dominance-rejection","token-value-pareto-incomparability"]}
