{"auditSha256":"7b890fc1daf816371d5f9dde249f9d76627881c015fb7312e16a7b039fe1a7ac","axiomDependentDeclarationCount":8,"axiomFreeDeclarationCount":10,"axiomInventory":["propext"],"declarationCount":18,"rfcClauseIds":["ASP-RFC-10.05-PEEC-CHECKPOINT-BINDING","ASP-RFC-10.05-PEEC-CHECKPOINT-CONTINUITY","ASP-RFC-10.05-PEEC-CLAIM-KIND","ASP-RFC-10.05-PEEC-CLAIM-STAGE-CLOSURE","ASP-RFC-10.05-PEEC-FEASIBILITY-FIRST","ASP-RFC-10.05-PEEC-INDEPENDENT-REPLAY","ASP-RFC-10.05-PEEC-INVOCATION-DECODE","ASP-RFC-10.05-PEEC-POLICY","ASP-RFC-10.05-PEEC-PREFIX-INSUFFICIENT","ASP-RFC-10.05-PEEC-RESOLUTION","ASP-RFC-10.05-PEEC-STRUCTURAL-PROJECTION","ASP-RFC-10.05-PEEC-SUBJECT"],"schemaId":"asp.axle-lean-audit-receipt.v1","schemaVersion":"1","theoremFamilies":["boolean-prefix-insufficiency","checkpoint-binding","checkpoint-continuity","checkpoint-rollback-rejection","claim-resolution","claim-stage-closure","claim-target-binding","cross-kind-rejection","cross-policy-rejection","feasibility-first","invocation-decode","replay-independence","structural-projection"]}
