{"auditSha256":"d9271f659934bbd177ca2c7856b5d28793d7844a385a93a0af123b27c342e1e3","axiomDependentDeclarationCount":7,"axiomFreeDeclarationCount":5,"axiomInventory":["propext"],"declarationCount":12,"rfcClauseIds":["ASP-RFC-10.05-PBR-ALPHA","ASP-RFC-10.05-PBR-BETA","ASP-RFC-10.05-PBR-COST","ASP-RFC-10.05-PBR-COUNT-COUNTEREXAMPLE","ASP-RFC-10.05-PBR-COVERAGE","ASP-RFC-10.05-PBR-DUPLICATE-CREDIT","ASP-RFC-10.05-PBR-MULTI","ASP-RFC-10.05-PBR-NO-BETA","ASP-RFC-10.05-PBR-ONE-CALL","ASP-RFC-10.05-PBR-REJECT","ASP-RFC-10.05-PBR-SOUNDNESS","ASP-RFC-10.05-PBR-UNIQUE-CREDIT"],"schemaId":"asp.axle-lean-audit-receipt.v1","schemaVersion":"1","theoremFamilies":["bundled-alpha-coverage","bundled-beta-coverage","certificate-cost-binding","count-only-counterexample","duplicate-credit-rejection","duplicate-relation-rejection","identity-coverage","missing-beta-witness","multi-route-cost-conservation","one-call-multi-route","realization-soundness","unique-progress-credit"]}
