{"auditSha256":"599c4d7b6448f9f354e4c42b330a4bfb037116df24c6ab1d47a8232b731aa54c","axiomDependentDeclarationCount":5,"axiomFreeDeclarationCount":5,"axiomInventory":["propext"],"declarationCount":10,"rfcClauseIds":["ASP-RFC-10.05-VCIF-DIRECT-FENCE","ASP-RFC-10.05-VCIF-GENERATION-NONIDENTITY","ASP-RFC-10.05-VCIF-GLOBAL-LIFT","ASP-RFC-10.05-VCIF-POLICY-IDENTITY","ASP-RFC-10.05-VCIF-SEMANTIC-BOUND","ASP-RFC-10.05-VCIF-TRANSITION-FENCE"],"schemaId":"asp.axle-lean-audit-receipt.v1","schemaVersion":"1","theoremFamilies":["admitted-global-lift","direct-generation-fence","generation-nonidentity","policy-identity","semantic-binding","transition-fence"]}
