{"auditSha256":"5689540c2c4f03ef753b969af0542995bd6c9acfac252f4edbfe34487770c01b","axiomDependentDeclarationCount":8,"axiomFreeDeclarationCount":2,"axiomInventory":["Classical.choice","Quot.sound","propext"],"declarationCount":10,"rfcClauseIds":["ASP-RFC-10.05-OCC-CONSERVATION","ASP-RFC-10.05-OCC-MODEL-ORTHOGONAL","ASP-RFC-10.05-OCC-NO-WORSE","ASP-RFC-10.05-OCC-PREFIX-TRANSPORT","ASP-RFC-10.05-OCC-REPLAY","ASP-RFC-10.05-OCC-SEARCH-ORTHOGONAL","ASP-RFC-10.05-OCC-SEARCH-STALE","ASP-RFC-10.05-OCC-SEMANTICS"],"schemaId":"asp.axle-lean-audit-receipt.v1","schemaVersion":"1","theoremFamilies":["cache-orthogonality","cost-conservation","cost-monotonicity","credit-bounds","credit-replay","prefix-generation-independence","prefix-transport","search-stale","semantic-preservation"]}
