{
  "auditSha256": "b7f4a8b5f3a3761a49f1aa82a2978018a83e5b9b74b846820b88140ba35bebc3",
  "axiomDependentDeclarationCount": 0,
  "axiomFreeDeclarationCount": 6,
  "axiomInventory": [],
  "declarationCount": 6,
  "rfcClauseIds": [
    "ASP-RFC-10.05.01.36-QUALIFICATION"
  ],
  "schemaId": "asp.axle-lean-audit-receipt.v1",
  "schemaVersion": "1",
  "theoremFamilies": [
    "polyglot-search-qualification"
  ]
}
