{"auditSha256":"26a11549d58c6dfb6e2cb3e054da3c491c2f20afee08a6ed27fd1adfed1853e7","axiomDependentDeclarationCount":5,"axiomFreeDeclarationCount":5,"axiomInventory":["propext"],"declarationCount":10,"rfcClauseIds":["ASP-RFC-10.05-DAP-CACHE","ASP-RFC-10.05-DAP-CERTIFIED","ASP-RFC-10.05-DAP-COLLISION","ASP-RFC-10.05-DAP-CONSERVES","ASP-RFC-10.05-DAP-FACTS","ASP-RFC-10.05-DAP-INJECTIVE","ASP-RFC-10.05-DAP-NONINJECTIVE","ASP-RFC-10.05-DAP-PARETO","ASP-RFC-10.05-DAP-REFLEXIVE","ASP-RFC-10.05-DAP-REPLAY"],"schemaId":"asp.axle-lean-audit-receipt.v1","schemaVersion":"1","theoremFamilies":["batch-facts-identity","cache-context-replay-rejection","certified-policy-conservation","deterministic-allocation-replay","deterministic-pareto-cost","digest-collision-counterexample","noninjective-digest-counterexample","policy-digest-injectivity","policy-evaluation-conservation","replay-comparability-reflexivity"]}
