{
  "auditSha256": "813e0ad39e674a8cb8ea8b47845aa1673af7bc03443436c736e5b63753edfe74",
  "axiomDependentDeclarationCount": 0,
  "axiomFreeDeclarationCount": 15,
  "axiomInventory": [],
  "declarationCount": 15,
  "rfcClauseIds": [
    "ASP-RFC-10.05.64-BOUNDED-RADIX",
    "ASP-RFC-10.05.64-COST-VECTOR",
    "ASP-RFC-10.05.64-FLOAT64-EXACTNESS",
    "ASP-RFC-10.05.64-LEXICOGRAPHIC-ORDER",
    "ASP-RFC-10.05.64-PYTHON-LEAN-CONFORMANCE"
  ],
  "schemaId": "asp.axle-lean-audit-receipt.v1",
  "schemaVersion": "1",
  "theoremFamilies": [
    "cache-domain-separation",
    "float64-exactness",
    "lexicographic-priority",
    "mixed-radix-bound",
    "python-lean-conformance"
  ]
}
