{"auditSha256":"795f37487a6a928aeac6fb72ef58596a32b175dd182d3921b7dd23fd93e375e7","axiomDependentDeclarationCount":5,"axiomFreeDeclarationCount":4,"axiomInventory":["propext"],"declarationCount":9,"rfcClauseIds":["ASP-RFC-10.05-CPC-BOUNDED","ASP-RFC-10.05-CPC-CURRENT","ASP-RFC-10.05-CPC-EXACT","ASP-RFC-10.05-CPC-GENERATION","ASP-RFC-10.05-CPC-LOCAL-ZERO","ASP-RFC-10.05-CPC-STALE","ASP-RFC-10.05-CPC-ZERO"],"schemaId":"asp.axle-lean-audit-receipt.v1","schemaVersion":"1","theoremFamilies":["bounded-optimality","current-completion","exact-optimality","generation-binding","local-zero-counterexample","stale-rejection","termination-gate"]}
