{"auditSha256":"ab98bcff0abfc161c85d6072bc62cdde88fa366036888da0de407f343c3d5eb5","axiomDependentDeclarationCount":8,"axiomFreeDeclarationCount":12,"axiomInventory":["propext"],"declarationCount":20,"rfcClauseIds":["ASP-RFC-10.05-VAP-BUILD-ATTESTATION","ASP-RFC-10.05-VAP-DIGEST-ASSUMPTION","ASP-RFC-10.05-VAP-EXECUTABLE-PROJECTION","ASP-RFC-10.05-VAP-FEASIBILITY-FIRST","ASP-RFC-10.05-VAP-HERMETIC-RECIPE","ASP-RFC-10.05-VAP-INDEPENDENT-REBUILD","ASP-RFC-10.05-VAP-PREFIX-INSUFFICIENT","ASP-RFC-10.05-VAP-SOURCE-SNAPSHOT","ASP-RFC-10.05-VAP-STAGE-CLOSURE","ASP-RFC-10.05-VAP-TRANSPARENCY"],"schemaId":"asp.axle-lean-audit-receipt.v1","schemaVersion":"1","theoremFamilies":["binary-binding","build-attestation","digest-assumption-boundary","executable-projection","feasibility-first","hermetic-recipe","independent-rebuild","prefix-insufficiency","source-snapshot","stage-closure","substitution-rejection","transparency"]}
