{
  "auditSha256": "617c85fe848b4bfff7f526632b4591e2286771e3194ab67f621642cbcd5df1c7",
  "axiomDependentDeclarationCount": 0,
  "axiomFreeDeclarationCount": 31,
  "axiomInventory": [],
  "declarationCount": 31,
  "rfcClauseIds": [
    "ASP-RFC-GSRGT-ASCENT",
    "ASP-RFC-GSRGT-AUTHORITY",
    "ASP-RFC-GSRGT-BUDGET",
    "ASP-RFC-GSRGT-CACHE",
    "ASP-RFC-GSRGT-CONTINUATION",
    "ASP-RFC-GSRGT-DERIVATION",
    "ASP-RFC-GSRGT-DESERIALIZATION",
    "ASP-RFC-GSRGT-DETERMINISM",
    "ASP-RFC-GSRGT-FIXED-POINT",
    "ASP-RFC-GSRGT-GQL",
    "ASP-RFC-GSRGT-GRAPH-DELTA",
    "ASP-RFC-GSRGT-HOPS",
    "ASP-RFC-GSRGT-MODEL-CACHE",
    "ASP-RFC-GSRGT-PARETO",
    "ASP-RFC-GSRGT-PROCESS",
    "ASP-RFC-GSRGT-PYTHON",
    "ASP-RFC-GSRGT-RENDERER",
    "ASP-RFC-GSRGT-RULESET",
    "ASP-RFC-GSRGT-SEARCH-CACHE",
    "ASP-RFC-GSRGT-SESSION",
    "ASP-RFC-GSRGT-SNAPSHOT",
    "ASP-RFC-GSRGT-TOKENS"
  ],
  "schemaId": "asp.axle-lean-audit-receipt.v1",
  "schemaVersion": "1",
  "theoremFamilies": [
    "bounded-ascent-admission",
    "bounded-gql-positive",
    "budget-only-fixed-point-counterexample",
    "cache-aggregate-counterexample",
    "cache-resume-semantic-invariance",
    "cache-semantic-hop-counterexample",
    "canonical-digest-counterexample",
    "closure-nonauthority",
    "cross-session-rejection",
    "decoded-hop-invariant",
    "decoded-hop-positive",
    "derived-fact-budget",
    "exact-session-positive",
    "graph-delta-refinement",
    "hop-first-needs-feasibility",
    "model-cache-orthogonality",
    "model-cache-positive",
    "pareto-feasibility",
    "process-session-separation",
    "projection-cache-positive",
    "projection-cache-snapshot-fence",
    "proposal-nonauthority",
    "python-proposal-nonauthority",
    "renderer-identity-noninterference",
    "rule-firing-budget",
    "scalar-rule-count-counterexample",
    "search-cache-orthogonality",
    "trusted-ruleset-rejection",
    "unbounded-gql-rejection",
    "verified-fixed-point-positive",
    "verified-fixed-point-rejection"
  ]
}
