{"auditSha256":"17280483e98e79384b3e96370e78853118156f34d071c1bab50db81f136e8ddf","axiomDependentDeclarationCount":5,"axiomFreeDeclarationCount":2,"axiomInventory":["Quot.sound","propext"],"declarationCount":7,"rfcClauseIds":["ASP-RFC-10.05-ALC-AUTHORIZED-COMMIT","ASP-RFC-10.05-ALC-BALANCE","ASP-RFC-10.05-ALC-CREDIT-BOUND","ASP-RFC-10.05-ALC-CREDIT-HISTORY","ASP-RFC-10.05-ALC-GROSS-HISTORY","ASP-RFC-10.05-ALC-REPLAY","ASP-RFC-10.05-ALC-REVISION"],"schemaId":"asp.axle-lean-audit-receipt.v1","schemaVersion":"1","theoremFamilies":["authorized-compensation","compensation-cas","credit-boundedness","historical-monotonicity","ledger-conservation"]}
