{
  "auditSha256": "181db878795f7148ad5af1fa90f26a79d4ab5a4cb5ee29b5be8ba9d15624fc6b",
  "axiomDependentDeclarationCount": 22,
  "axiomFreeDeclarationCount": 18,
  "axiomInventory": [
    "Quot.sound",
    "propext"
  ],
  "declarationCount": 40,
  "rfcClauseIds": [
    "ASP-RFC-10.32-ENSURE-IDEMPOTENCE",
    "ASP-RFC-10.32-FIXED-HOOK-CONTRACT",
    "ASP-RFC-10.32-GLOBAL-SERVER-IDENTITY",
    "ASP-RFC-10.32-GRACEFUL-STOP",
    "ASP-RFC-10.32-INTERNAL-PROJECT-DISPATCH",
    "ASP-RFC-10.32-RESTART-CONVERGENCE",
    "ASP-RFC-10.32-SOCKET-LIVENESS-AUTHORITY",
    "ASP-RFC-10.32-SOCKET-SECURITY-HARDENING",
    "ASP-RFC-10.32-TYPED-FAILURE"
  ],
  "schemaId": "asp.axle-lean-audit-receipt.v1",
  "schemaVersion": "1",
  "theoremFamilies": [
    "authenticated-socket-liveness",
    "concurrent-ensure-singleton",
    "connection-bound-fail-closed",
    "drain-bound-fail-closed",
    "endpoint-hint-not-liveness",
    "ensure-idempotence",
    "fixed-hook-contract-preservation",
    "frame-bound-fail-closed",
    "global-server-state-home-identity",
    "graceful-stop-admission-fence",
    "graceful-stop-drain-checkpoint",
    "hook-worker-bound-fail-closed",
    "identity-mismatch-fail-closed",
    "internal-project-dispatch-isolation",
    "internal-project-dispatch-targeting",
    "kernel-peer-uid-admission",
    "missing-socket-election",
    "no-project-server-identity",
    "nonce-capacity-bound",
    "nonce-capacity-exhaustion-no-eviction",
    "nonce-capacity-exhaustion-no-mutation",
    "nonce-owner-epoch-single-use",
    "nonce-recorded-single-use",
    "nonce-replay-fail-closed",
    "nonce-replay-no-mutation",
    "operator-stop-precedence",
    "protocol-mismatch-fail-closed",
    "provider-failure-global-lifecycle-isolation",
    "provider-failure-project-isolation",
    "recorded-nonce-replay-fail-closed",
    "refused-socket-election",
    "restart-assumption-convergence",
    "restart-assumption-counterexample",
    "runtime-directory-owner-symlink-security",
    "runtime-path-private-modes",
    "secret-redaction",
    "socket-file-not-liveness",
    "socket-liveness-handshake-necessity",
    "socket-resource-bounds",
    "typed-startup-failure"
  ]
}
